id,text,label
534,完整的四十分钟的作品，构思独特，武打风格严密，超越新武侠，功夫时代的全面来临！,1
535,（三星半）有些地方实在还是不错，战争部分不太喜欢。,1
536,忘了名字，搜了半天，好不容易搜到了，真是不易，所以强烈推荐。,1
537,励志轻喜剧，讲述男人中年危机的奋斗故事，看起来轻松也很有感触。,1
538,终于明白为什么他们说美国人那虚伪的感情很讨厌了,1
539,摄影风格 眉头那道疤 写完给玛丽的信，推门进去，恰玛丽纵身跃下,1
540,看完之后唯一的想法的就是 给妈妈打一个电话,1
541,拍的并没有太煽情，但也并不深刻，引人深思。,1
542,虽然主旋律，但还是推荐！很感动！美景。美人。美歌！,1
543,总感觉影片拍的不够完整，无论是结局还是其中的细节,1
544,彼时的黛米·摩尔空灵得出神入化。看到阴阳两界的眷侣相拥，泪水渐湿眼眶。,1
545,嗯，很喜欢这样的亲情电影。为什么哥哥的妻子一直不去医院看婆婆呢？弟弟很可爱，一家很可爱的人哇。,1
546,女主真是尤物啊，结局被黑色幽默了一把，和整部片子的冷幽默基调一致，安娜卡列宁娜出场也是神来之笔哈哈,1
547,成功实现零歌舞的同时，又让人可以通过一部电影改变对一个国家电影产业的看法，甚至是一个国家的看法,1
548,改编了一些，但是小托比真的很可爱，所以四星吧。,1
549,怎么有点像名侦探柯南呢，每个可怕的凶杀案背后都有一个凄美的故事。。。,1
550,张智霖的情感好低沉又好深刻，华仔好矛盾，总之，那个年代，这种拍摄效果，一定是花了大价钱的啊！,1
551,很喜欢这种风格~但是还是有写内容每太看懂。。。要是能有个随时都可以查的历史百科辞典就好了~呜~,1
552,桃花片片，随水染尘埃。朝云暮雨，还向梦中来。,1
553,略微煽情，但不狗血，拍出了那个年龄的迷茫和叛逆。不错的校园电影，青春片。,1
554,几年前看的，看完之后挺久了才回神，第一次因为看了一部电影反思自己。是我心中电影的第一名～,1
555,比前几部都好看 甚至还有点电锯惊魂的意思,1
556,有爱的脱衣舞.有爱的哥哥.有爱的舅舅.除了爸爸.大家都有爱叻.,1
557,笑死了，他灵感迸发的时候是无敌的。黄梁一梦的结局在那时候也许不是大俗套吧。,1
558,哪里能找到这片啊？美妙的音乐，精彩的剪接，不知道现在再看还会有当年的感觉吗？,1
559,让巴斯光年承认自己其实只是一个玩具，和告诉小朋友圣诞老人根本不存在，哪个更惨？#弥补童年空白系列#,1
560,金凯瑞演神经病绝对出神入化~哈哈 可是我一点都没笑出来...,1
561,多的一星给教练~~~~英语不懂，橄榄球又看不懂，还能把这电影坚持看完不容易,1
562,刚到海边的屋子时，蓝毛在阳台望着海边站了很久。后来，画本上有了男主站在海边的图。被暖到了。,1
563,我觉得要比《日照重庆》更，怎么说呢，朴实一点吧。,1
564,有点魔幻风，男主很帅很舒服，比伯惊喜出现，赛琳娜有点胖了吧，剧情挺搞笑的,1
565,第一次看达内...发现我还是很喜欢这种风格朴素的片子的。几次心情来回起落真打动人。,1
566,这么少人看，太好看了，感觉霍克好孤独的一个小孩子,1
567,西班牙男生非常可爱。给所有不定心的孩子们一个警示：陌生人危险，珍惜身边人。,1
568,很有设计感，不同寻常的韩片，有南美实验之作的质感。,1
569,我觉得比第一部要恐怖诶，而且剧情和时空设定都要更加精密，酒井法子真漂亮！,1
570,如何去审视这个世界 这部影片值得一座小金人,1
571,全程惊悚无尿点，小李子的演技真的一直被低估,1
572,友谊也系阿狄对阿祖讲，我最有耐心的就系等你出来。,1
573,反正我是看得哈哈大笑很开心啊，觉得比现在好多喜剧片好看~~~,1
574,极其残酷的老阿。。。美丽的色彩和音乐之下 都是一个个心生绝望的故事,1
575,故事可能真的很俗，但是有舞蹈成分作为弥补。。。,1
576,对生活细节那么敏感的导演 是怎么想到找个越南妹来演中国人的呢 而且还那么土。。。,1
577,没想到这么新这个电影。觉得配角比主角好呢。主角不太像丘吉尔的感觉。,1
578,有点晦涩。宗教也好，哲学也罢，玛丽一生都在和符号打交道。,1
579,精彩的剪辑、光影、镜头、音乐，同时电影所表现的原始暴力，让人赞叹不已。,1
580,"有点想哭,不怎么为什么.可能和最近的心情有关",1
581,文艺是平淡生活的致幻剂，因为怂，遇到什么样的姑娘也没用,1
582,2009.3.22资料馆 星空，列车奔跑在白色原野上。默片一样的镜头，细无声。,1
583,好看好看 演得太好了 难怪是宝莱坞第一男演员,1
584,褒曼美到惨绝人寰，和秋日奏鸣曲里落差。。。,1
585,金城武的演技是很好的，我以往只关注了他的帅气。这其实也是不大公平的。,1
586,可爱纯良的春马，还是那么迷惘的小树，可爱的老头，那个特别的夏天因为你而改变,1
587,治愈系的……虽然故事有点儿。。。但是，马利最高！,1
588,总是要给它贴上青春的标签才会觉得没有遗憾。尼玛太文艺唠哎！,1
589,小时候还看过画呢。感觉小象的生活很惨，我都害怕了。但是他还是活了下来。,1
590,没看完，因为看过后面那版，主要是为了看小百合有多漂亮……,1
591,非常有爱的电影，不过最近很少见到有重播的了。,1
592,太多经典梗了，老电影节奏也很流畅，爱死梦露和白考尔！,1
593,两部《棋王》衔接的天衣无缝，罗大佑的《爱人同志》锦上添花。,1
594,这个电影挺好看的  不同年龄段的爱情故事  越往后越好看。黄昏恋那段我蛮喜欢的  影帝和天后的碰撞~,1
595,少数民族与普世两大元素结合地恰到好处。松太加在创作方向上，非常清醒，这点太重要了。,1
596,雷公的片子都是在探讨造物者和被造者的关系，最后的红海不比星际穿越弱,1
597,躲这个片子躲了好久，终于明正典刑的看了。。。,1
598,那首《沧海一声笑》真是太经典了，许冠杰完全破坏我心目中令狐冲形象,1
599,数度落泪。画面非常美，故事非常美。中国电影佳作。,1
600,个人挺喜欢这种类型的电影，觉得比超级英雄片好看,1
